{
  "schema_version": "chat-context-response-v1",
  "response_id": "ctx-response-drop-1042-1",
  "request_id": "ctx-drop-1042",
  "event_id": "drop-1042",
  "incident_id": "inc-drop-1042",
  "incident_version": 1,
  "context_round": 1,
  "provided_context": [
    "The source is assigned to employee Taylor Reed for approved remote maintenance.",
    "Maintenance on 10.0.3.10 over HTTPS is scheduled for the current change window."
  ],
  "provided_by": {
    "id": "chat-agent-1",
    "role": "organizational-context-broker"
  },
  "issued_at": "2026-07-18T17:01:00Z",
  "trust": "UNTRUSTED_ADVISORY"
}
